{
  "schema_version": "m1",
  "workflow_revision_id": "workflow-rev-simple-001",
  "artifact_lifecycle_state": "completed",
  "decisions": [
    {
      "request_id": "approval-request-001",
      "decision": "approved",
      "approved_by": "fixture-user",
      "approved_at": "2026-06-05T10:00:00Z"
    }
  ]
}
